Date,Source,Region,Headline,Link
2026-02-11,ArXiv Biotech,Global,Recovering Whole-Brain Causal Connectivity under Indirect Observation with Applications to Human EEG and fMRI,https://arxiv.org/abs/2602.09034
2026-02-11,ArXiv Biotech,Global,Predicting Gene Disease Associations in Type 2 Diabetes Using Machine Learning on Single-Cell RNA-Seq Data,https://arxiv.org/abs/2602.09036
2026-02-11,ArXiv Biotech,Global,scBench: Evaluating AI Agents on Single-Cell RNA-seq Analysis,https://arxiv.org/abs/2602.09063
2026-02-11,ArXiv Biotech,Global,AntigenLM: Structure-Aware DNA Language Modeling for Influenza,https://arxiv.org/abs/2602.09067
2026-02-11,ArXiv Biotech,Global,Reply To: Global Gridded Population Datasets Systematically Underrepresent Rural Population by Josias L\'ang-Ritter et al,https://arxiv.org/abs/2602.09248
2026-02-11,ArXiv Biotech,Global,Population-scale Ancestral Recombination Graphs with tskit 1.0,https://arxiv.org/abs/2602.09649
2026-02-11,ArXiv Biotech,Global,Open diffusion MRI and connectivity data for epilepsy and surgery: The IDEAS II release,https://arxiv.org/abs/2602.09852
2026-02-11,ArXiv Biotech,Global,A dialog between cell adhesion and topology at the core of morphogenesis,https://arxiv.org/abs/2602.09867
2026-02-11,ArXiv Biotech,Global,Importance inversion transfer identifies shared principles for cross-domain learning,https://arxiv.org/abs/2602.09116
2026-02-11,ArXiv Biotech,Global,Reward-Guided Discrete Diffusion via Clean-Sample Markov Chain for Molecule and Biological Sequence Design,https://arxiv.org/abs/2602.09424
