Date,Source,Region,Headline,Link
2026-02-06,ArXiv Biotech,Global,Beyond Independent Genes: Learning Module-Inductive Representations for Gene Perturbation Prediction,https://arxiv.org/abs/2602.04901
2026-02-06,ArXiv Biotech,Global,AFD-INSTRUCTION: A Comprehensive Antibody Instruction Dataset with Functional Annotations for LLM-Based Understanding and Design,https://arxiv.org/abs/2602.04916
2026-02-06,ArXiv Biotech,Global,Combination therapy for colorectal cancer with anti-PD-L1 and cancer vaccine: A multiscale mathematical model of tumor-immune interactions,https://arxiv.org/abs/2602.05118
2026-02-06,ArXiv Biotech,Global,Learning virulence-transmission relationships using causal inference,https://arxiv.org/abs/2602.05196
2026-02-06,ArXiv Biotech,Global,Specieslike clusters based on identical ancestor points,https://arxiv.org/abs/2602.05274
2026-02-06,ArXiv Biotech,Global,Somatic Mechanotherapy Activates a Spatiotemporally Synchronized CPTC Wnt Axis for Gut Regeneration,https://arxiv.org/abs/2602.05451
2026-02-06,ArXiv Biotech,Global,Intermittent precipitation and spatial Allee effects drive irregular vegetation patterns in semiarid ecosystems,https://arxiv.org/abs/2602.05583
2026-02-06,ArXiv Biotech,Global,A novel scalable high performance diffusion solver for multiscale cell simulations,https://arxiv.org/abs/2602.05017
2026-02-06,ArXiv Biotech,Global,Optimal Harvesting in Stream Networks: Maximizing Biomass and Yield,https://arxiv.org/abs/2602.05071
2026-02-06,ArXiv Biotech,Global,Characterizing Human Semantic Navigation in Concept Production as Trajectories in Embedding Space,https://arxiv.org/abs/2602.05971
